checklist_id,term,wave,source_set,baseline_file,baseline_line,baseline_dp_id,baseline_section,baseline_commit,first_use_file,first_use_line,recommended_file,recommended_section,placement_priority,placement_fitness_rating,divergence_match_category,divergence_reliability,divergence_similarity,before_evidence_ref,action_type,decision_detail,reason_code,reason_why,reason_quality,semantic_change_flag,review_attention,after_file,after_line,after_dp_id,after_section,after_commit,after_evidence_ref,phase1_status,final_quality,batch_id,quarantine_status,quarantine_reason,notes,rationale_uuid,rationale_inserted_at_utc,rationale_text_sha256,recommendation_priority,recommendation_used,deviation_permit_path,deviation_permit_sha256,deviation_approved_by,deviation_status,definition_operation,definition_similarity,glossary_definition_sha256,chapter_definition_sha256,definition_normalization_version
WB-064,type parameter,WB,v2-placement-priority,expressions.rst,1463,fls_8imzo7agyx0k,Arithmetic Expressions,19e75856eac5694e5d613c7c59b429848d333992,expressions.rst,1479,generics.rst,Generic Parameters,medium,questionable,significant_reword,low,,inputs/fls-pr6-placement-fitness-v2.json:term=type parameter,move,Promoted the existing canonical type parameter sentence in Generic Parameters and removed the arithmetic-expression-local definition marker.,relocate-conceptual-owner,"Before, Arithmetic Expressions carried a local type parameter marker tied to operator rules, which weakened conceptual ownership. After, Generic Parameters now hosts the canonical definition sentence at its chapter owner anchor, improving navigation and preserving Rust 2021 semantics with no normative change.",pass,none,none,generics.rst,105,fls_95eooah0vcqx,Generic Parameters,d076cff76794857e3095e285e372394607f94ac8,,completed,resolved-high,batch-018,,,,0fee5160-67f1-4d7e-9753-cfcab14981f2,2026-02-13T00:41:26Z,220ad2ca1da5061b04438fb68dbc4c602373853791c5de738ca9f95f4a65820b,medium,yes,,,,,promote,1.000000,14f4076bff348aad2568245f342d9dfee3a6ea081edce07852899140cf6d30d3,14f4076bff348aad2568245f342d9dfee3a6ea081edce07852899140cf6d30d3,v1
WB-065,implicit borrow,WB,v2-placement-priority,expressions.rst,509,fls_zepwytjwy049,Place Expressions,19e75856eac5694e5d613c7c59b429848d333992,expressions.rst,553,ownership-and-deconstruction.rst,Borrowing,medium,questionable,significant_reword,low,,inputs/fls-pr6-placement-fitness-v2.json:term=implicit borrow,move,Promoted the canonical implicit borrow sentence in Borrowing and kept Place Expressions occurrences as usage.,relocate-conceptual-owner,"Before, Place Expressions used implicit borrow as contextual terminology, so the definition signal was embedded in expression-context bullets. After, Borrowing carries the glossary-aligned definition sentence at its owner location, improving discoverability and preserving Rust 2021 behavior unchanged.",pass,none,none,ownership-and-deconstruction.rst,183,fls_zepwytjwy049,Borrowing,d076cff76794857e3095e285e372394607f94ac8,,completed,resolved-high,batch-018,,,,530c7cf0-aaec-4b2d-b0f2-b9cf2da432f5,2026-02-13T00:41:45Z,db4f865b3bfc96be96a53258f2893d9dbbb442a435e1f93d7dfaf975c4a85233,medium,yes,,,,,promote,1.000000,9823e2a9e2fbfbfee04cb8d9382e1e5d933c98f60f30f400ba4a96476878488d,9823e2a9e2fbfbfee04cb8d9382e1e5d933c98f60f30f400ba4a96476878488d,v1
WB-066,associated type,WB,v2-placement-priority,expressions.rst,1172,fls_8cz4rdrklaj4,Dereference Expression,19e75856eac5694e5d613c7c59b429848d333992,expressions.rst,1231,associated-items.rst,Associated Items,medium,questionable,significant_reword,low,,inputs/fls-pr6-placement-fitness-v2.json:term=associated type,move,Promoted the canonical associated type sentence in Associated Items and demoted dereference-expression-local wording to term usage.,relocate-conceptual-owner,"Before, Dereference Expression referenced associated type inside deref mechanics, which obscured the term owner and made lookup harder. After, Associated Items now contains the canonical chapter-owned definition sentence, improving ownership and discoverability while keeping Rust 2021 semantics unchanged.",pass,none,none,associated-items.rst,32,fls_8cz4rdrklaj4,Associated Items,d076cff76794857e3095e285e372394607f94ac8,,completed,resolved-high,batch-018,,,,a0656bd9-f567-49c1-9195-9098bf49271e,2026-02-13T00:42:20Z,038aebd2d759b5e51b6ebedf3939130119b00cd63cb3a0ee9ba7d1530f647b3c,medium,yes,,,,,promote,1.000000,21c01b0be0d13f6f2398e51efbd825679fd7a93278db757996fdcd69bbf2ec07,21c01b0be0d13f6f2398e51efbd825679fd7a93278db757996fdcd69bbf2ec07,v1
WB-067,binding argument,WB,v2-placement-priority,generics.rst,436,fls_ltch5eivxgaa,Generic Conformance,19e75856eac5694e5d613c7c59b429848d333992,expressions.rst,3889,expressions.rst,Closure Expressions,medium,questionable,significant_reword,low,,inputs/fls-pr6-placement-fitness-v2.json:term=binding argument,move,Inserted the canonical binding argument definition in Closure Expressions and demoted Generic Conformance’s conformance-only sentence.,relocate-first-use-owner,"Before, Generic Conformance defined binding argument only in a conformance rule, so readers met the term earlier in closure return-type wording without a chapter definition. After, Closure Expressions now includes the canonical sentence at first-use context, improving ordering and discoverability with no Rust 2021 semantic change.",pass,none,none,expressions.rst,3919,fls_wb067bindingarg,Closure Expressions,d076cff76794857e3095e285e372394607f94ac8,,completed,resolved-high,batch-018,,,,82ffcf3d-5ab2-4350-bf78-7389047500f2,2026-02-13T00:42:20Z,1abb63602cc9e835133848e5526f74220d7f6d989f743ba3df1afcd81bf61bbf,medium,yes,,,,,insert,1.000000,722096d9e2d594202dd9d10f2692b8435d90d95824a72fd74d68e02ebf630df0,722096d9e2d594202dd9d10f2692b8435d90d95824a72fd74d68e02ebf630df0,v1
WB-068,future,WB,v2-placement-priority,expressions.rst,5059,fls_sjz5s71hwm7l,Await Expressions,19e75856eac5694e5d613c7c59b429848d333992,expressions.rst,5058,expressions.rst,Await Expressions,medium,questionable,significant_reword,low,,inputs/fls-pr6-placement-fitness-v2.json:term=future,move,Kept future in Await Expressions where the chapter already defines the term at first-use and in immediate operational context.,relocate-first-use-owner,"Before at expressions.rst:5059 with dp id fls_sjz5s71hwm7l, future was only implicitly introduced through await-expression wording and was less discoverable as its own anchor. After at expressions.rst:5098 with dp id fls_wb068future, a standalone canonical-aligned definition sits in Await Expressions at first-use context, improving lookup and preserving Rust 2021 semantics.",pass,none,none,expressions.rst,5098,fls_wb068future,Await Expressions,215baf8847a28b6fe3b29e8e77a2418d3ee64a63,,completed,resolved-high,batch-020,,,,5cefcc91-31e1-4007-976c-382fa19892bb,2026-02-13T01:51:46Z,d288e0aa55955ce2e434b99026c5aa2a33090d664bb21b1a559a0e6afbc281fc,medium,yes,,,,,promote,0.916667,ab6a62659bd64beb55619bb156922d2ce3b754256c9847fb3ad1abd78cbe5639,312e2c586168e82c302ca543d2942e42d2cbdffd5a45f36a9641ccccadc438f2,v1
WB-069,label,WB,v2-placement-priority,expressions.rst,3994,fls_1MTa81vtePN8,Loop Expressions,19e75856eac5694e5d613c7c59b429848d333992,expressions.rst,887,expressions.rst,Named Blocks,medium,questionable,moderate_divergence,medium,,inputs/fls-pr6-placement-fitness-v2.json:term=label,move,Confirmed label in Named Blocks where the chapter-owned sentence is canonical and positioned at early first-use context.,relocate-first-use-owner,"Before at expressions.rst:3994 with dp id fls_1MTa81vtePN8, label appeared under Loop Expressions and was less discoverable when entering named-block control flow. After at expressions.rst:921 with dp id fls_wb069label, the canonical definition is anchored in Named Blocks where first-use occurs earlier, improving ownership and preserving Rust 2021 semantics without meaning change.",pass,none,none,expressions.rst,921,fls_wb069label,Named Blocks,215baf8847a28b6fe3b29e8e77a2418d3ee64a63,,completed,resolved-high,batch-020,,,,e97d5e70-e1fe-4105-b16d-2b32768269dc,2026-02-13T01:51:56Z,4a580b23b3f8d891480adddfe47dbdfb4246b56a9ecca4a1ab344e6e2d679976,medium,yes,,,,,promote,1.000000,a4696e68792717836f8d1130fdd302f9198ae777117f1e0d49d6e44d9499d5ef,a4696e68792717836f8d1130fdd302f9198ae777117f1e0d49d6e44d9499d5ef,v1
WB-070,static initializer,WB,v2-placement-priority,expressions.rst,328,fls_t17h5h6a6v4c,Constant Expressions,19e75856eac5694e5d613c7c59b429848d333992,expressions.rst,2529,values.rst,Statics,medium,questionable,significant_reword,low,,inputs/fls-pr6-placement-fitness-v2.json:term=static initializer,move,Promoted the canonical static initializer sentence in Statics and demoted Constant Expressions list usage.,relocate-conceptual-owner,"Before, Constant Expressions marked static initializer inside a context enumeration, which was not a chapter-owned definition home. After, Statics carries the canonical definition sentence at its owner anchor, improving ownership and navigation while preserving Rust 2021 semantics.",pass,none,none,values.rst,201,fls_t17h5h6a6v4c,Statics,d076cff76794857e3095e285e372394607f94ac8,,completed,resolved-high,batch-018,,,,bbbd0cc3-5094-4147-8176-b653a4803bc7,2026-02-13T00:42:51Z,3d88e05f234759b298691ea0c4c998796edbc02b36bd41780456f2b217b2a2b5,medium,yes,,,,,promote,1.000000,59511acffdadc32483c2a3c7af35e4822123c748a1b9a995e956c45a594f2d21,59511acffdadc32483c2a3c7af35e4822123c748a1b9a995e956c45a594f2d21,v1
WB-071,arity,WB,v2-placement-priority,patterns.rst,1074,fls_ivWBnhfOZUrW,Tuple Struct Patterns,19e75856eac5694e5d613c7c59b429848d333992,patterns.rst,1163,patterns.rst,Tuple Patterns,medium,questionable,significant_reword,low,,inputs/fls-pr6-placement-fitness-v2.json:term=arity,move,Confirmed arity in Tuple Patterns where the existing sentence is already canonical and naturally discoverable in deconstruction rules.,relocate-first-use-owner,"Before at patterns.rst:1074 with dp id fls_ivWBnhfOZUrW, arity was coupled to tuple-struct-pattern positioning text and was weaker for direct definition lookup. After at patterns.rst:1153 with dp id fls_wb071arity, the canonical glossary wording is anchored in Tuple Patterns where first-use deconstruction behavior is explained, improving discoverability while preserving Rust 2021 semantics.",pass,none,none,patterns.rst,1153,fls_wb071arity,Tuple Patterns,215baf8847a28b6fe3b29e8e77a2418d3ee64a63,,completed,resolved-high,batch-020,,,,c1c856db-99b5-4584-a070-1cd2dff74716,2026-02-13T01:52:06Z,3db138e2e2a9ee2f49750139c1d05ce7d69e37082c952759481333310bc85800,medium,yes,,,,,promote,1.000000,d6c873ff4dcfbef2a7977f456570b6588de26c2c56a9decf7ca02125b40701f5,d6c873ff4dcfbef2a7977f456570b6588de26c2c56a9decf7ca02125b40701f5,v1
WB-072,constant parameter,WB,v2-placement-priority,generics.rst,441,fls_gb3mpt5rxjoa,Generic Conformance,19e75856eac5694e5d613c7c59b429848d333992,expressions.rst,313,generics.rst,Generic Parameters,medium,questionable,significant_reword,low,,inputs/fls-pr6-placement-fitness-v2.json:term=constant parameter,move,Promoted the canonical constant parameter definition in Generic Parameters and demoted Generic Conformance marker usage.,relocate-conceptual-owner,"Before, Generic Conformance carried constant parameter in argument-check wording, which weakened chapter ownership for the core generic concept. After, Generic Parameters now has the canonical sentence as its chapter definition, improving discoverability and preserving Rust 2021 meaning without normative change.",pass,none,none,generics.rst,84,fls_vpcqgec83ybt,Generic Parameters,d076cff76794857e3095e285e372394607f94ac8,,completed,resolved-high,batch-018,,,,5123d911-d417-4628-9835-c65b793ca03d,2026-02-13T00:43:25Z,d48dfe1dcbb5a394de7cfdf015b2158e8d99a7f9a2e31d9678cd373924cfcb28,medium,yes,,,,,promote,1.000000,85e40564026eeadec5ec759594fac76c3c52b414865d8e0ab1cedf1536cb3330,85e40564026eeadec5ec759594fac76c3c52b414865d8e0ab1cedf1536cb3330,v1
WB-073,mutable static,WB,v2-placement-priority,expressions.rst,468,fls_doi4z6u55bi7,Place Expressions,19e75856eac5694e5d613c7c59b429848d333992,expressions.rst,661,values.rst,Statics,medium,questionable,significant_reword,low,,inputs/fls-pr6-placement-fitness-v2.json:term=mutable static,move,Promoted mutable static in Statics and removed mutable-place-expression-local definition emphasis.,relocate-conceptual-owner,"Before, Place Expressions marked mutable static as part of mutability context, which did not provide the chapter-owned definition home. After, Statics carries the canonical mutable static sentence at its owner anchor, improving ownership and lookup while preserving Rust 2021 semantics.",pass,none,none,values.rst,187,fls_doi4z6u55bi7,Statics,d076cff76794857e3095e285e372394607f94ac8,,completed,resolved-high,batch-018,,,,def536cf-763f-4ecf-915e-b1cb97a7084b,2026-02-13T00:43:26Z,359d03ad79f3f0217fc2310fdc27ea96db241bba793c51a5d71b9a5ab15f0146,medium,yes,,,,,promote,0.777778,f1c66770d9da0af9b3649647d4d612f0b6343745991b3db19726ca1e82c379ee,80a6756358d57f2eb1d1c6393bcfca546920a63c99fe4a030d3f93f53051e223,v1
WB-074,scalar type,WB,v2-placement-priority,expressions.rst,5367,fls_oFIRXBPXu6Zv,Arithmetic Overflow,19e75856eac5694e5d613c7c59b429848d333992,expressions.rst,5368,patterns.rst,Range Patterns,medium,questionable,significant_reword,low,,inputs/fls-pr6-placement-fitness-v2.json:term=scalar type,move,Inserted the canonical scalar type definition in Range Patterns and demoted arithmetic-overflow-local marker usage.,relocate-first-use-owner,"Before, Arithmetic Overflow defined scalar type inside overflow behavior, which tied the term to one rule and reduced first-use discoverability in pattern constraints. After, Range Patterns now includes the canonical sentence at a dedicated anchor, improving ordering while preserving Rust 2021 semantics.",pass,none,none,patterns.rst,555,fls_wb074scalartype,Range Patterns,d076cff76794857e3095e285e372394607f94ac8,,completed,resolved-high,batch-018,,,,b56f2b1b-b9a1-464f-ad7f-3bb9605bb822,2026-02-13T00:43:26Z,79940e14277a5ffba7f9947f354c50801345bfd072b89516385651386c77b3f0,medium,yes,,,,,insert,1.000000,a837b4957c5fb8d0e399a9cee61393da6a5574f749ad1ff259fba04f38a17466,a837b4957c5fb8d0e399a9cee61393da6a5574f749ad1ff259fba04f38a17466,v1
WB-075,constant parameter initializer,WB,v2-placement-priority,generics.rst,491,fls_3SjMBlc0b7qo,Generic Conformance,19e75856eac5694e5d613c7c59b429848d333992,types-and-traits.rst,2531,generics.rst,Generic Parameters,medium,questionable,significant_reword,low,,inputs/fls-pr6-placement-fitness-v2.json:term=constant parameter initializer,move,Promoted the canonical constant parameter initializer sentence in Generic Parameters and demoted Generic Conformance fallback phrasing.,relocate-conceptual-owner,"Before, Generic Conformance used constant parameter initializer only in residual-argument rules, which is not the owner chapter for the construct. After, Generic Parameters carries the canonical definition sentence at its chapter anchor, improving ownership and discoverability with no Rust 2021 semantic change.",pass,none,none,generics.rst,87,fls_3SjMBlc0b7qo,Generic Parameters,d076cff76794857e3095e285e372394607f94ac8,,completed,resolved-high,batch-018,,,,e2fb932e-6699-4253-8dc9-18c1f54cdd8c,2026-02-13T00:43:26Z,0cb2fecb763be895174f3ad37db55779b630651985958fef399ca5e57a97c54b,medium,yes,,,,,promote,1.000000,88803a94a35af4170c7524b27662197cf2cac9bbe07789a8ff100393571d3e53,88803a94a35af4170c7524b27662197cf2cac9bbe07789a8ff100393571d3e53,v1
WB-076,immutable reference,WB,v2-placement-priority,expressions.rst,5310,fls_aCxt2Ovmb5He,Capturing,19e75856eac5694e5d613c7c59b429848d333992,expressions.rst,5311,ownership-and-deconstruction.rst,Borrowing,medium,questionable,significant_reword,low,,inputs/fls-pr6-placement-fitness-v2.json:term=immutable reference,move,Inserted the canonical immutable reference definition in Borrowing and demoted capture-mode-local marker usage.,relocate-conceptual-owner,"Before, Capturing used immutable reference within capture-mode mechanics, which made the definition local to closure implementation details. After, Borrowing now includes the canonical immutable reference sentence at an owner anchor, improving conceptual ownership and preserving Rust 2021 semantics.",pass,none,none,ownership-and-deconstruction.rst,216,fls_wb076immutableref,Borrowing,d076cff76794857e3095e285e372394607f94ac8,,completed,resolved-high,batch-018,,,,c09d6f77-e3ed-497b-836c-a9945f93ecc5,2026-02-13T00:44:00Z,c565c2816db0c6c9a34a103f15da28f298567298b7b7f73a75121bd6e53873ec,medium,yes,,,,,insert,1.000000,366ae48688aa7732d09a2012e736422445765e77ba9ed7615c1f598d0c0273fc,366ae48688aa7732d09a2012e736422445765e77ba9ed7615c1f598d0c0273fc,v1
WB-077,external function,WB,v2-placement-priority,general.rst,215,fls_v24ino4hix3m,Conformity,19e75856eac5694e5d613c7c59b429848d333992,types-and-traits.rst,1105,ffi.rst,External Functions,medium,questionable,significant_reword,low,,inputs/fls-pr6-placement-fitness-v2.json:term=external function,move,Promoted the canonical external function definition in External Functions and demoted Conformity-list marker usage.,relocate-conceptual-owner,"Before, Conformity listed external function as one external interaction, which is not the concept owner and weakens term discoverability. After, External Functions now carries the canonical sentence at its chapter-owned location, improving ownership and preserving Rust 2021 semantics.",pass,none,none,ffi.rst,225,fls_v24ino4hix3m,External Functions,d076cff76794857e3095e285e372394607f94ac8,,completed,resolved-high,batch-018,,,,22270133-b6f2-4f76-9455-62ba70b4674d,2026-02-13T00:44:00Z,a9a6e44c75741bbc0f330209a46a347fb0769e47e6a8615ee06386ce8cdad481,medium,yes,,,,,promote,1.000000,07177c6bac082d69a5dfe9db3619d30e2c6e509d45bf7d8997740e9450acfa52,07177c6bac082d69a5dfe9db3619d30e2c6e509d45bf7d8997740e9450acfa52,v1
WB-078,external static,WB,v2-placement-priority,general.rst,218,fls_8ddsytjr4il6,Conformity,19e75856eac5694e5d613c7c59b429848d333992,values.rst,180,ffi.rst,External Statics,medium,questionable,significant_reword,low,,inputs/fls-pr6-placement-fitness-v2.json:term=external static,move,Promoted the canonical external static definition in External Statics and demoted Conformity-list marker usage.,relocate-conceptual-owner,"Before, Conformity referenced external static only as an interaction class, so the term was not chapter-owned for direct lookup. After, External Statics contains the canonical definition sentence at its owner anchor, improving discoverability and keeping Rust 2021 semantics unchanged.",pass,none,none,ffi.rst,264,fls_8ddsytjr4il6,External Statics,d076cff76794857e3095e285e372394607f94ac8,,completed,resolved-high,batch-018,,,,82cc3b31-0993-4378-be0c-c16e93519ce2,2026-02-13T00:44:01Z,1abddc24ebed9b58f4936ed0c442fbe9ba30527011e529c0e71773b394e683c8,medium,yes,,,,,promote,1.000000,2b15b3b412b7d60718de64c82d8ad690f382ae4b9ac59d9557aa846591f9cc2a,2b15b3b412b7d60718de64c82d8ad690f382ae4b9ac59d9557aa846591f9cc2a,v1
WB-079,unit enum variant,WB,v2-placement-priority,patterns.rst,173,fls_r2m9k6t1v4pa,Identifier Patterns,19e75856eac5694e5d613c7c59b429848d333992,expressions.rst,654,expressions.rst,Path Expressions,medium,questionable,exact_match,high,,inputs/fls-pr6-placement-fitness-v2.json:term=unit enum variant,move,Inserted the canonical unit enum variant definition in Path Expressions and demoted Identifier Patterns marker usage.,relocate-first-use-owner,"Before, Identifier Patterns defined unit enum variant in pattern-specific matching context, while Path Expressions is where this wave first introduces path-based entity forms. After, Path Expressions now carries the canonical sentence at first-use location, improving discoverability and preserving Rust 2021 meaning.",pass,none,none,expressions.rst,673,fls_wb079unitenumvariant,Path Expressions,d076cff76794857e3095e285e372394607f94ac8,,completed,resolved-high,batch-018,,,,904be03c-c5b2-48f3-8ece-8ea75b970040,2026-02-13T00:44:01Z,79c1819a437311c02b23ca1fde15f364e3d9b6c393bbba0614cf063df3962834,medium,yes,,,,,insert,1.000000,a006960ca3e64ec71e66dcf7c27de5b041e05e025fda4e968e14a40b42501ace,a006960ca3e64ec71e66dcf7c27de5b041e05e025fda4e968e14a40b42501ace,v1
WB-080,tuple struct,WB,v2-placement-priority,expressions.rst,3495,fls_q1m7v9b3k5ha,Call Expressions,19e75856eac5694e5d613c7c59b429848d333992,expressions.rst,654,expressions.rst,Path Expressions,medium,questionable,exact_match,high,,inputs/fls-pr6-placement-fitness-v2.json:term=tuple struct,move,Confirmed tuple struct in Path Expressions at the existing canonical sentence and first-use anchor.,relocate-first-use-owner,"Before at expressions.rst:3495 with dp id fls_q1m7v9b3k5ha, tuple struct appeared in call-construction context and was less discoverable as a standalone definition. After at expressions.rst:675 with dp id fls_wb080tuplestruct, the canonical glossary sentence is anchored in Path Expressions at first-use context, improving ordering and discoverability with no Rust 2021 semantic change.",pass,none,none,expressions.rst,675,fls_wb080tuplestruct,Path Expressions,215baf8847a28b6fe3b29e8e77a2418d3ee64a63,,completed,resolved-high,batch-020,,,,f1aca28c-7080-4b4a-a9c8-ec3a3668017b,2026-02-13T01:52:16Z,5fbf30a27330b5df32f2916adddafe2cec90bb95f0989a6bfbcdb24efd5d1b87,medium,yes,,,,,promote,1.000000,75763d862100f85f091b5f741e1a594c066b992d4f21886ec56dc81862e5d09d,75763d862100f85f091b5f741e1a594c066b992d4f21886ec56dc81862e5d09d,v1
WB-081,binary crate,WB,v2-placement-priority,attributes.rst,2179,fls_7mzjahvdzpy5,Attribute ``windows_subsystem``,19e75856eac5694e5d613c7c59b429848d333992,attributes.rst,2186,program-structure-and-compilation.rst,Crates,medium,questionable,significant_reword,low,,inputs/fls-pr6-placement-fitness-v2.json:term=binary crate,move,Moved binary crate definition to Crates and demoted windows_subsystem-local marker.,relocate-conceptual-owner,"Before at attributes.rst:2179 with dp id fls_7mzjahvdzpy5, binary crate was defined inside the windows_subsystem attribute rule, which is narrow and weak for chapter ownership. After at program-structure-and-compilation.rst:129 with dp id fls_9ub6ks8qrang, the canonical sentence is in Crates where crate kinds are owned and easier to discover, with no Rust 2021 semantic change.",pass,none,none,program-structure-and-compilation.rst,129,fls_9ub6ks8qrang,Crates,a7096e60a1e912190b62a7e6936dac44374b3689,,completed,resolved-high,batch-019,,,,9ca5c1b4-06e2-4b0a-ac2c-ed468be75432,2026-02-13T00:51:00Z,815e4513dae00d9b8c17e43e05a02710d6a1532eaa5940bf2d448d215aaf0472,medium,yes,,,,,promote,1.000000,b81f561bc715ba0fd93933cad9140923c9968c17db19a8a2824101425e669af0,b81f561bc715ba0fd93933cad9140923c9968c17db19a8a2824101425e669af0,v1
WB-082,c,WB,v2-placement-priority,types-and-traits.rst,1176,fls_B0SMXRqQMS1E,Function Pointer Types,19e75856eac5694e5d613c7c59b429848d333992,types-and-traits.rst,1771,ffi.rst,ABI,medium,questionable,significant_reword,low,,inputs/fls-pr6-placement-fitness-v2.json:term=c,,,,,,,,,,,,,,pending,pending,batch-020,open,parent row is not checked,,,,,,,,,,,,,,,
WB-083,qualifying trait,WB,v2-placement-priority,entities-and-resolution.rst,373,fls_e65q3iz50j6a,Paths,19e75856eac5694e5d613c7c59b429848d333992,entities-and-resolution.rst,364,entities-and-resolution.rst,Paths,medium,questionable,exact_match,high,,inputs/fls-pr6-placement-fitness-v2.json:term=qualifying trait,move,Verified qualifying trait remains at the recommended Paths anchor.,no-change-not-mislocated,"Before and after at entities-and-resolution.rst:376 with dp id fls_e65q3iz50j6a, qualifying trait is already defined in Paths at the recommended first-use location. Keeping this anchor preserves ordering and discoverability in the owning path-resolution context, and introduces no Rust 2021 semantic change.",pass,none,none,entities-and-resolution.rst,376,fls_e65q3iz50j6a,Paths,a7096e60a1e912190b62a7e6936dac44374b3689,,completed,resolved-high,batch-019,,,,4beb0c05-01e4-41bf-aaa7-d81d63bd5ea2,2026-02-13T00:51:10Z,4d290207633d46cd5a55d293add9ddbc0bdd87a35be207ac43b4a4ef70fe72c7,medium,yes,,,,,promote,1.000000,09142ff767419242abf74f9cf2f3ecc666dc7f3dcac9c05209ebc2c97079ad62,09142ff767419242abf74f9cf2f3ecc666dc7f3dcac9c05209ebc2c97079ad62,v1
WB-084,temporary,WB,v2-placement-priority,expressions.rst,434,fls_awpw61yofckz,Place Expressions,19e75856eac5694e5d613c7c59b429848d333992,expressions.rst,475,expressions.rst,Await Expressions,medium,questionable,significant_reword,low,,inputs/fls-pr6-placement-fitness-v2.json:term=temporary,move,Confirmed temporary in Await Expressions where the chapter anchor is already canonical and well placed for operational discoverability.,relocate-conceptual-owner,"Before at expressions.rst:434 with dp id fls_awpw61yofckz, temporary was tied to generic place-expression context and did not provide the strongest owner anchor for async evaluation flow. After at expressions.rst:5107 with dp id fls_wb084temporary, the canonical glossary sentence is explicit in Await Expressions, improving discoverability and preserving Rust 2021 semantics.",pass,none,none,expressions.rst,5107,fls_wb084temporary,Await Expressions,215baf8847a28b6fe3b29e8e77a2418d3ee64a63,,completed,resolved-high,batch-020,,,,3f285680-8532-44f9-a04d-4119928effa7,2026-02-13T01:52:25Z,cf17fe7c5da7a14f8bd8966aed62d73b637c96671801f68de162989c51c1549d,medium,yes,,,,,promote,1.000000,196ef529d57d38a9d8b87dfe33c92ae6f444e7784d0e2ed2364da831c23933d5,196ef529d57d38a9d8b87dfe33c92ae6f444e7784d0e2ed2364da831c23933d5,v1
