checklist_id,term,wave,source_set,baseline_file,baseline_line,baseline_dp_id,baseline_section,baseline_commit,first_use_file,first_use_line,recommended_file,recommended_section,placement_priority,placement_fitness_rating,divergence_match_category,divergence_reliability,divergence_similarity,before_evidence_ref,action_type,decision_detail,reason_code,reason_why,reason_quality,semantic_change_flag,review_attention,after_file,after_line,after_dp_id,after_section,after_commit,after_evidence_ref,phase1_status,final_quality,batch_id,quarantine_status,quarantine_reason,notes,rationale_uuid,rationale_inserted_at_utc,rationale_text_sha256,recommendation_priority,recommendation_used,deviation_permit_path,deviation_permit_sha256,deviation_approved_by,deviation_status,definition_operation,definition_similarity,glossary_definition_sha256,chapter_definition_sha256,definition_normalization_version
WA-001,value,WA,v2-foundational,expressions.rst,2214,fls_buyaqara7am4,Type Cast Expressions,19e75856eac5694e5d613c7c59b429848d333992,lexical-elements.rst,34,lexical-elements.rst,Character Set,high,poor,exact_match,high,,inputs/fls-pr6-placement-fitness-v2.json:term=value,move,Moved canonical value definition from Type Cast Expressions into Values and removed the out-of-place duplicate definition paragraph from Expressions.,relocate-conceptual-owner,"Before at expressions.rst:2214 (:dp:) the value definition sat inside Type Cast Expressions, which hurt discoverability and ownership. After at values.rst:27 (:dp:) the canonical sentence is placed in Values, so the foundational concept is defined at its chapter owner with no Rust 2021 semantic change.",pass,none,none,values.rst,27,fls_buyaqara7am4,Values,e1a41fe065bf361375daaeeeea5df19365e50992,,completed,resolved-high,batch-001,,,,e842913b-aba5-452f-843e-7843a3142cc0,2026-02-12T20:04:09Z,b15a3b0fb956f36163b7f4f67accaa77771f2484a3d572602a1d0657a40c6e70,high,yes,,,,,insert,1.000000,4ddd1cffea21c0b93d3ffd6397c43f6647fcb4214c08f8c83b492e8dcc512f09,4ddd1cffea21c0b93d3ffd6397c43f6647fcb4214c08f8c83b492e8dcc512f09,v1
WA-002,expression,WA,v2-foundational,types-and-traits.rst,2522,fls_h5o6tgul4yor,Type Inference,19e75856eac5694e5d613c7c59b429848d333992,macros.rst,648,macros.rst,Macro Expansion,high,poor,significant_reword,low,,inputs/fls-pr6-placement-fitness-v2.json:term=expression,move+rewrite,Promoted the canonical expression definition in Expressions and demoted the non-definitional Type Inference occurrence to term usage markup.,relocate-conceptual-owner,"Before at types-and-traits.rst:2522 in Type Inference, the expression occurrence was embedded in a constant-initializer bullet and was not the chapter-owned definitional location. After at expressions.rst:78 with dp id fls_h5o6tgul4yor, the canonical sentence is defined in Expressions for better ownership and discoverability while preserving Rust 2021 meaning.",pass,none,required,expressions.rst,78,fls_h5o6tgul4yor,Expressions,e1a41fe065bf361375daaeeeea5df19365e50992,,completed,resolved-high,batch-001,,,,bff6bb2d-a085-4f8a-87b0-29d891debaed,2026-02-12T20:04:19Z,17d54c55b3880bd01a7aebc124ee0334cbdd75254af58495e70c11490e7f58d1,high,yes,,,,,promote,1.000000,08a29caf147923c9652bb24c848a2008d77ebfcc85ae7679cd83fcb0b7edc8cf,08a29caf147923c9652bb24c848a2008d77ebfcc85ae7679cd83fcb0b7edc8cf,v1
WA-003,type,WA,v2-foundational,types-and-traits.rst,2240,fls_4rhjpdu4zfqj,Type Coercion,19e75856eac5694e5d613c7c59b429848d333992,lexical-elements.rst,614,,,none,acceptable,exact_match,high,,inputs/fls-pr6-placement-fitness-v2.json:term=type,retain+rewrite,Retained Type Coercion placement and adapted the sentence to subject form so the chapter definition satisfies guarded definition-shape checks.,no-change-not-mislocated,"Before and after at types-and-traits.rst:2240 with dp id fls_4rhjpdu4zfqj, placement remained acceptable in Type Coercion. I changed wording from defines to is a set so the paragraph is subject-form for dt extraction guardrails, while preserving the same semantic content and Rust 2021 meaning with no relocation needed.",pass,clarification-only,required,types-and-traits.rst,2240,fls_4rhjpdu4zfqj,Type Coercion,e1a41fe065bf361375daaeeeea5df19365e50992,,completed,resolved-high,batch-001,,,,8c3f54ed-8864-4b78-afdc-35eeb352b498,2026-02-12T20:04:48Z,9435f813ed5fe5ed052cc74c1d8f0c8fbb76bb1159a29787f504c70ef47c4ada,none,no,,,,,adapt,0.888889,c2bb227a0023d03dd2948bbd6e236cdf3340188326aa3a5c2c41584d4778b987,897d31ad1745d2cffce67239a556229a8cf43c128c33d0f76d176126937e60e4,v1
WA-004,trait,WA,v2-foundational,entities-and-resolution.rst,1758,fls_tani6lesan9u,Path Expression Resolution,19e75856eac5694e5d613c7c59b429848d333992,expressions.rst,222,expressions.rst,Constant Expressions,high,poor,significant_reword,low,,inputs/fls-pr6-placement-fitness-v2.json:term=trait,move,Resolved trait placement to the canonical Traits definition in types-and-traits and treated the existing sentence as the chapter-owned definition.,relocate-conceptual-owner,"Before at entities-and-resolution.rst:1758 the trait mention appears inside Path Expression Resolution and does not provide the canonical ownership location. After at types-and-traits.rst:2982 with dp id fls_tani6lesan9u, the chapter-owned Traits definition matches glossary text exactly, improving discoverability and preserving Rust 2021 meaning without semantic change.",pass,none,none,types-and-traits.rst,2982,fls_tani6lesan9u,Traits,c05c97ad04d3bd0265ef74c2663e85ffc45c544e,,completed,resolved-high,batch-004,,,,dc0dac80-96a5-4b68-9acc-a88694242e44,2026-02-12T20:14:18Z,0fcff7b3b4b6fa36d1f06c46f5321f7b60bbfcfba46dbc6d86598c48df5a3181,high,yes,,,,,promote,1.000000,d72481243552714286b806ee534e14a797aac21bf51facf20f0f111e4b668e54,d72481243552714286b806ee534e14a797aac21bf51facf20f0f111e4b668e54,v1
WA-005,construct,WA,v2-foundational,entities-and-resolution.rst,527,fls_3nqb7p5ifvio,Generic Parameter Scope,19e75856eac5694e5d613c7c59b429848d333992,general.rst,158,lexical-elements.rst,Comments,low_forward_ref,acceptable_at_home,significant_reword,low,,inputs/fls-pr6-placement-fitness-v2.json:term=construct,retain,Retained construct in Generic Parameter Scope because the chapter already contains the canonical definitional sentence aligned with glossary text.,retain-conceptual-owner,"Before and after at entities-and-resolution.rst:525 with dp id fls_2tk3wryqpzev, construct is defined in a canonical ownership context for scope and validity rules. Keeping the definition here preserves first-use discoverability within the chapter, keeps the exact glossary-aligned wording, and introduces no Rust 2021 semantic change.",pass,none,none,entities-and-resolution.rst,525,fls_2tk3wryqpzev,Generic Parameter Scope,c05c97ad04d3bd0265ef74c2663e85ffc45c544e,,completed,resolved-high,batch-004,,,,55e89ea2-2c35-4f23-8c40-5a31f22da724,2026-02-12T20:14:27Z,429d41f9d113c397d87dcd6d1f0ab8778fa6bd37f91a42a22d6ef2a6267460e0,low_forward_ref,no,,,,,promote,1.000000,6a775ca137946cbbddb41be1b23c1cd631640134901b0e4a89a32f62ae6cfdfc,6a775ca137946cbbddb41be1b23c1cd631640134901b0e4a89a32f62ae6cfdfc,v1
WA-006,entity,WA,v2-foundational,entities-and-resolution.rst,1537,fls_p23q1ob2qitz,Path Resolution,19e75856eac5694e5d613c7c59b429848d333992,expressions.rst,665,expressions.rst,Path Expressions,low_forward_ref,acceptable_at_home,significant_reword,low,,inputs/fls-pr6-placement-fitness-v2.json:term=entity,retain,Retained entity in Path Resolution because the existing chapter sentence is already the canonical definition and matches glossary wording.,retain-conceptual-owner,"Before and after at entities-and-resolution.rst:1541 with dp id fls_41of3g2m26q7, entity remains in Path Resolution where naming and lookup rules establish ownership and discoverability. The chapter definition is already glossary-equivalent, so retaining it avoids churn and preserves Rust 2021 semantics with no meaning change.",pass,none,none,entities-and-resolution.rst,1541,fls_41of3g2m26q7,Path Resolution,c05c97ad04d3bd0265ef74c2663e85ffc45c544e,,completed,resolved-high,batch-004,,,,af3eac20-ab92-48b1-a642-f21e16871680,2026-02-12T20:14:36Z,11595fbbc4bab70fa375ebb1066c43cd2946f072d0940933893b2894ff9498c0,low_forward_ref,no,,,,,promote,1.000000,d41189a260f82327e8019180fa3c62179ca9a276c9827c942fe4b4a1575d409b,d41189a260f82327e8019180fa3c62179ca9a276c9827c942fe4b4a1575d409b,v1
WA-007,name,WA,v2-foundational,entities-and-resolution.rst,151,fls_7kpepal8ghuj,Visibility,19e75856eac5694e5d613c7c59b429848d333992,lexical-elements.rst,488,lexical-elements.rst,Identifiers,low_forward_ref,acceptable_at_home,significant_reword,low,,inputs/fls-pr6-placement-fitness-v2.json:term=name,retain,Retained the chapter-owned name definition in Visibility because the canonical glossary sentence already exists there.,retain-conceptual-owner,"Before at entities-and-resolution.rst:151 (dp id fls_7kpepal8ghuj), name only appeared as an inline term inside the visibility definition, which was weaker for direct term discoverability. After at entities-and-resolution.rst:154 (dp id fls_2m0qkn47vy9d), name is defined as its own glossary-aligned subject sentence in the same conceptual-owner section, improving local lookup without changing Rust 2021 semantics.",pass,none,none,entities-and-resolution.rst,154,fls_2m0qkn47vy9d,Visibility,e498c8d6275cffce4640683ec664fa527d5bf010,,completed,resolved-high,batch-009,,,,2be268f7-a8b8-4109-a0d8-76fd940f2438,2026-02-12T21:36:27Z,c7f7fb1a7c6cb6fd6714d242bc47559ba3bef48b44009dbaad1118f45efb14fc,low_forward_ref,no,,,,,promote,1.000000,27a8fc003bb8f6c6b75d63bc485ba428678df9632d7b5eb53b456460005242d7,27a8fc003bb8f6c6b75d63bc485ba428678df9632d7b5eb53b456460005242d7,v1
WA-008,item,WA,v2-foundational,macros.rst,498,fls_knjsslplv5ri,Attribute Macros,19e75856eac5694e5d613c7c59b429848d333992,macros.rst,497,macros.rst,Macro Expansion,high,poor,significant_reword,low,,inputs/fls-pr6-placement-fitness-v2.json:term=item,move,Inserted the canonical item definition in Items so the foundational term is defined in its required chapter owner location.,relocate-conceptual-owner,"Before at macros.rst:498 with dp id fls_knjsslplv5ri, item appeared in attribute macro wording rather than a standalone owner definition, which reduced discoverability for the core concept. After at items.rst:46 with dp id fls_d0q4h7p2m9vx, item is defined with the canonical glossary sentence in the Items chapter, improving ownership and navigation with no Rust 2021 semantic change.",pass,none,none,items.rst,46,fls_d0q4h7p2m9vx,Items,7b8d1eb9dd185fb5bacb2a6d93f2736287a5621b,,completed,resolved-high,batch-006,,,,e3af1928-a2f0-49e7-8a3a-ee1ed00890f0,2026-02-12T21:26:29Z,38e21f890ea9517cc1b43ebdb28b07fda120318a10093d794e39488c1e7f0653,high,yes,,,,,insert,1.000000,829f637f8e219a2fc5bf6ccc83dae3b454ec75b19f41cf26a21728f317729da1,829f637f8e219a2fc5bf6ccc83dae3b454ec75b19f41cf26a21728f317729da1,v1
WA-009,field,WA,v2-foundational,patterns.rst,844,fls_mnh35ehva8tx,Record Struct Patterns,19e75856eac5694e5d613c7c59b429848d333992,expressions.rst,1039,expressions.rst,Borrow Expression,high,poor,significant_reword,low,,inputs/fls-pr6-placement-fitness-v2.json:term=field,move,Inserted the canonical field definition in Struct Types so the foundational term resides in the required type-owner chapter.,relocate-conceptual-owner,"Before at patterns.rst:844 with dp id fls_mnh35ehva8tx, field appeared as part of indexed deconstructor wording and not as the owner chapter definition, which limited first-read discoverability. After at types-and-traits.rst:909 with dp id fls_f2v8k1m4q9zd in Struct Types, field now has the canonical glossary-aligned sentence at the required foundational location, with no Rust 2021 semantic change.",pass,none,none,types-and-traits.rst,909,fls_f2v8k1m4q9zd,Struct Types,7b8d1eb9dd185fb5bacb2a6d93f2736287a5621b,,completed,resolved-high,batch-006,,,,57cb84d8-9402-4ecd-97f5-64cb95c77a10,2026-02-12T21:26:51Z,8ad1951bf166673ecc5c6b4081af5c27f21a2e1b27a4d0ca3b92bdb6b68697a3,high,yes,,,,,insert,1.000000,5a75553fb8251adb7128025ae40652400de507a4c1e32071c417e9e4361dbd83,5a75553fb8251adb7128025ae40652400de507a4c1e32071c417e9e4361dbd83,v1
WA-010,reference,WA,v2-foundational,expressions.rst,1019,fls_ya77l2zgtilp,Borrow Expression,19e75856eac5694e5d613c7c59b429848d333992,expressions.rst,1006,ownership-and-deconstruction.rst,References,high,poor,significant_reword,low,,inputs/fls-pr6-placement-fitness-v2.json:term=reference,move,Inserted the canonical reference definition in the References section so the foundational term is chapter-owned in ownership-and-deconstruction.,relocate-conceptual-owner,"Before at expressions.rst:1019 with dp id fls_ya77l2zgtilp, the defining wording appeared under Borrow Expression instead of the ownership chapter that conceptually owns references. After at ownership-and-deconstruction.rst:102 with dp id fls_2s9h4k8v1qpm, References now contains the canonical glossary sentence as a standalone chapter definition, improving ownership and discoverability while preserving Rust 2021 semantics with no meaning change.",pass,none,none,ownership-and-deconstruction.rst,102,fls_2s9h4k8v1qpm,References,d7c8a943cb79877d59c37e17f26d678797fbb0c2,,completed,resolved-high,batch-007,,,,8f491159-b8f7-4944-8d6b-ba1a38c8d6a0,2026-02-12T21:29:56Z,8e20167fdb547df24b14d557100a0fcd81b64dd35535e1b0d040d2ffa89a7cae,high,yes,,,,,insert,1.000000,760ffb165802c54f35f7569e6f75440061518c83a27dc711972a51023b99b3dc,760ffb165802c54f35f7569e6f75440061518c83a27dc711972a51023b99b3dc,v1
WA-011,implementation,WA,v2-foundational,generics.rst,65,fls_z311nxou9yi3,Generic Parameters,19e75856eac5694e5d613c7c59b429848d333992,expressions.rst,1457,expressions.rst,Arithmetic Expressions,high,poor,significant_reword,low,,inputs/fls-pr6-placement-fitness-v2.json:term=implementation,move+rewrite,Promoted the canonical implementation sentence in Implementations by rewriting term markup to chapter-definitional form at the required foundational location.,relocate-conceptual-owner,"Before at generics.rst:65 with dp id fls_z311nxou9yi3, the implementation definition sat in generic-parameter context and did not provide chapter ownership for the foundational concept. After at implementations.rst:40 with dp id fls_ivxpoxggy7s6, Implementations now carries the canonical definition in chapter-owned form, improving discoverability and conceptual placement while preserving Rust 2021 semantics with no normative change.",pass,none,required,implementations.rst,40,fls_ivxpoxggy7s6,Implementations,d7c8a943cb79877d59c37e17f26d678797fbb0c2,,completed,resolved-high,batch-007,,,,67fbf606-35f9-440f-be1f-3c697d66baee,2026-02-12T21:31:13Z,e94467d86633897b0b12a4ef9018be2bf7abb3623f850db1749cbf162f268197,high,yes,,,,,promote,1.000000,4a7fa3bcafae03041764e720b737ae53a36f862190ae897612d884c72f19510f,4a7fa3bcafae03041764e720b737ae53a36f862190ae897612d884c72f19510f,v1
WA-012,method,WA,v2-foundational,expressions.rst,3654,fls_b7i26954j1hc,Method Call Expressions,19e75856eac5694e5d613c7c59b429848d333992,expressions.rst,3659,,,none,good,significant_reword,low,,inputs/fls-pr6-placement-fitness-v2.json:term=method,move,Inserted the canonical method definition into the Functions chapter to satisfy foundational ownership and chapter-level discoverability.,relocate-conceptual-owner,"Before at expressions.rst:3654 with dp id fls_b7i26954j1hc, method appeared inside method-call wording in Expressions rather than the chapter that defines function forms and self parameters. After at functions.rst:75 with dp id fls_4jrj1t4jcf8p, Functions now contains the canonical standalone definition sentence, improving foundational ownership and discoverability with no Rust 2021 semantic change.",pass,none,none,functions.rst,75,fls_4jrj1t4jcf8p,Functions,d7c8a943cb79877d59c37e17f26d678797fbb0c2,,completed,resolved-high,batch-007,,,,59e8cb4d-2708-47e0-92a6-02e44a944083,2026-02-12T21:30:19Z,f4fabc5a0f4039b34eae395073116bc0fd3e5b9a0ea9b18f747a8a84088c4f80,none,yes,,,,,insert,1.000000,be1c8d8c7a33739cb246abed6fd47427e1610d1810d139310c3310afc64b4452,be1c8d8c7a33739cb246abed6fd47427e1610d1810d139310c3310afc64b4452,v1
WA-013,crate,WA,v2-foundational,macros.rst,316,fls_pcce9gmjpxba,Procedural Macros,19e75856eac5694e5d613c7c59b429848d333992,types-and-traits.rst,53,program-structure-and-compilation.rst,Crates,high,poor,significant_reword,low,,inputs/fls-pr6-placement-fitness-v2.json:term=crate,move+rewrite,Promoted the canonical crate definition in Crates and demoted the procedural-macro-local crate occurrence to term usage.,relocate-conceptual-owner,"Before at macros.rst:316 (:dp:) crate was defined inside procedural macro constraints, which obscured ownership and discoverability for the foundational term. After at program-structure-and-compilation.rst:113 (:dp:) the canonical glossary sentence defines crate in Crates, and the macros sentence now uses :t: markup; this improves conceptual placement with no Rust 2021 semantic change.",pass,none,required,program-structure-and-compilation.rst,113,fls_qwghk79ok5h0,Crates,4fd7d55f96566be5c307ef650898fed084befb79,,completed,resolved-high,batch-008,,,,cc8523e7-3bef-4d9d-949f-9d96685ee862,2026-02-12T21:33:53Z,249f22150ca1619a5544f35791d45726ef71e00fed564d4fdf352ae19fd636b8,high,yes,,,,,promote,1.000000,93ad24fb8c65ec04dcea20d39e0c7b41ebb44d1c95de60ba27b359da4bf864ff,93ad24fb8c65ec04dcea20d39e0c7b41ebb44d1c95de60ba27b359da4bf864ff,v1
WA-014,module,WA,v2-foundational,program-structure-and-compilation.rst,73,fls_odd1hj3y1mgu,Modules,19e75856eac5694e5d613c7c59b429848d333992,macros.rst,735,entities-and-resolution.rst,Visibility,low_forward_ref,acceptable_at_home,exact_match,high,,inputs/fls-pr6-placement-fitness-v2.json:term=module,retain,Retained the existing module definition in Modules because it is already chapter-owned and glossary-aligned.,retain-conceptual-owner,"Before and after at program-structure-and-compilation.rst:73 (dp id fls_odd1hj3y1mgu), module remains defined in the Modules section, which is the conceptual owner and already matches the glossary sentence exactly. Retaining this anchor preserves ordering and discoverability for first readers without relocation and introduces no Rust 2021 semantic change.",pass,none,none,program-structure-and-compilation.rst,73,fls_odd1hj3y1mgu,Modules,4fd7d55f96566be5c307ef650898fed084befb79,,completed,resolved-high,batch-008,,,,3f33bc31-5789-40e4-8688-3b791731959e,2026-02-12T21:34:05Z,0686cc3cae36b97f096be4daf4f200187b01ccebb434c18f11c0dd800348c207,low_forward_ref,no,,,,,promote,1.000000,e825fa0e30fbbb835292cdfe0c0f0c179c5ef46690b40c001cae7880db025fc0,e825fa0e30fbbb835292cdfe0c0f0c179c5ef46690b40c001cae7880db025fc0,v1
WA-015,statement,WA,v2-foundational,macros.rst,552,fls_6v06zvi1ctub,Macro Invocation,19e75856eac5694e5d613c7c59b429848d333992,macros.rst,656,statements.rst,Statements,medium,questionable,significant_reword,low,,inputs/fls-pr6-placement-fitness-v2.json:term=statement,move+rewrite,Inserted the canonical statement definition in Statements and demoted the macro-invocation-local statement usage in Macros.,relocate-conceptual-owner,"Before at macros.rst:552 (dp id fls_6v06zvi1ctub), statement was defined only as part of terminated macro invocation wording, which is not the chapter owner for the foundational concept. After at statements.rst:25 (dp id fls_v4q2n8m1x7pc), the canonical glossary sentence defines statement in Statements and the macro paragraph now uses term markup, improving ownership and discoverability with no Rust 2021 semantic change.",pass,none,required,statements.rst,25,fls_v4q2n8m1x7pc,Statements,4fd7d55f96566be5c307ef650898fed084befb79,,completed,resolved-high,batch-008,,,,06df6cf6-abb1-4495-a66e-5f8084868ac3,2026-02-12T21:34:15Z,cb2765f281745622fbea0cab924d171dd19b54a7298541ec348eb42257dd1476,medium,yes,,,,,insert,1.000000,bcbd8aa7a09d5bd247b7a410bc2e730d4cddb607a484c0555270dcfc7ab5645a,bcbd8aa7a09d5bd247b7a410bc2e730d4cddb607a484c0555270dcfc7ab5645a,v1
WB-001,field list,WB,v2-placement-priority,types-and-traits.rst,772,fls_YERnNZiSdCRn,Enum Types,19e75856eac5694e5d613c7c59b429848d333992,expressions.rst,658,expressions.rst,Path Expressions,high,poor,cosmetic,high,,inputs/fls-pr6-placement-fitness-v2.json:term=field list,move,Moved field list definition into Path Expressions as the chapter-owned location and demoted Enum Types usage markup.,relocate-first-use-owner,"Before at types-and-traits.rst:772 with dp id fls_YERnNZiSdCRn, field list was defined in Enum Types even though the first normative use appears in Path Expressions. After at expressions.rst:669 with dp id fls_wb001fieldlist, the canonical sentence is in first-use context, improving ownership and discoverability without changing Rust 2021 meaning.",pass,none,none,expressions.rst,669,fls_wb001fieldlist,Path Expressions,ff766f962cba79c4378b21f83105c8909ebc4364,,completed,resolved-high,batch-010,,,,7d268b3e-899f-4c5d-a7ac-815bed13be1b,2026-02-12T23:11:29Z,8f10f911793f6bc20fc271501277388e3c0bfad12828640b92ef07a8c98a8e47,high,yes,,,,,insert,1.000000,df7800f88d97f474a8f56a6fd4dc54c80508b6164c2b76a225895a39e805e858,df7800f88d97f474a8f56a6fd4dc54c80508b6164c2b76a225895a39e805e858,v1
WB-002,type specification,WB,v2-placement-priority,entities-and-resolution.rst,759,fls_9k9hourczbv7,Scope Hierarchy,19e75856eac5694e5d613c7c59b429848d333992,macros.rst,355,macros.rst,Function-like Macros,high,poor,significant_reword,low,,inputs/fls-pr6-placement-fitness-v2.json:term=type specification,move,Moved type specification definition into Function-like Macros and demoted the Scope Hierarchy occurrence to term usage.,relocate-first-use-owner,"Before at entities-and-resolution.rst:766 with dp id fls_9k9hourczbv7, type specification was embedded in scope-hierarchy text rather than where readers first encounter it in this batch. After at macros.rst:343 with dp id fls_wb002typespec, the chapter sentence is now first-use aligned for discoverability, with no Rust 2021 semantic change.",pass,none,required,macros.rst,343,fls_wb002typespec,Function-like Macros,ff766f962cba79c4378b21f83105c8909ebc4364,,completed,resolved-high,batch-010,,,,e14dba90-9330-427f-acee-c1b084766028,2026-02-12T23:12:40Z,8a95688f02d6ec72d75a067f03b2bea521d8b8b092ed74f8e96f7b9ed7e66474,high,yes,,,,,adapt,0.800000,d093e4977396d5d06ae3473c434828b91fc542b4c3a007f3649c90838aa2027d,da54e4491a25aed23a0b10a56a8f32296be3c011d2ac65239372ca3a3580fbec,v1
WB-003,concrete type,WB,v2-placement-priority,attributes.rst,1711,fls_61vt1r8g51nh,Attribute ``type_length_limit``,19e75856eac5694e5d613c7c59b429848d333992,types-and-traits.rst,56,types-and-traits.rst,Types,high,poor,significant_reword,low,,inputs/fls-pr6-placement-fitness-v2.json:term=concrete type,move,Promoted concrete type in Types and removed the attribute-local definition marker from type_length_limit context.,relocate-conceptual-owner,"Before at attributes.rst:1711 with dp id fls_61vt1r8g51nh, concrete type was tied to a specific attribute rule and was weak as the owning location. After at types-and-traits.rst:56 with dp id fls_cTF1sJ9I2XJd, the canonical sentence is chapter-owned in Types, improving ownership and navigation while preserving Rust 2021 semantics.",pass,clarification-only,none,types-and-traits.rst,56,fls_cTF1sJ9I2XJd,Types,ff766f962cba79c4378b21f83105c8909ebc4364,,completed,resolved-high,batch-010,,,,a09246d1-73fc-4822-a62f-2b9c5855ea84,2026-02-12T23:12:40Z,22f2f65773b4b87f3a1d31e9e29c17fc8895f19055ba1bed79e932ae9a503d3c,high,yes,,,,,promote,1.000000,fa51cda6a5a34cae1c0493a844eacf83824b888f79028f70fc14d7c062faf80c,fa51cda6a5a34cae1c0493a844eacf83824b888f79028f70fc14d7c062faf80c,v1
WB-004,generic function,WB,v2-placement-priority,values.rst,168,fls_mt94jvoot9dx,Statics,19e75856eac5694e5d613c7c59b429848d333992,generics.rst,62,generics.rst,Generic Parameters,high,poor,significant_reword,low,,inputs/fls-pr6-placement-fitness-v2.json:term=generic function,move,Promoted generic function in Generic Parameters and removed the static-specific definition marker in Values.,relocate-conceptual-owner,"Before at values.rst:172 with dp id fls_mt94jvoot9dx, generic function appeared only as part of a static rule and not as the owner definition. After at generics.rst:62 with dp id fls_ixmgqupxvf73, the canonical sentence is in Generic Parameters where the concept is introduced, improving ownership and discoverability with no Rust 2021 semantic change.",pass,none,none,generics.rst,62,fls_ixmgqupxvf73,Generic Parameters,ff766f962cba79c4378b21f83105c8909ebc4364,,completed,resolved-high,batch-010,,,,cedebb3b-c5fc-47f3-b6b5-c67f9d04786a,2026-02-12T23:12:41Z,6d292abaf7f3882f0e9a9d7ea98b60e431e4c69c90ad9afecfef7ac71e25344e,high,yes,,,,,promote,1.000000,e71647f4d2c3ae7e57a835910311c28e343d4cbced5d1352a47cc327885f7d15,e71647f4d2c3ae7e57a835910311c28e343d4cbced5d1352a47cc327885f7d15,v1
